{"job_id":"1f0c2c9a-2f1a-4a3e-9d1a-3b6c8e5d4f21","scores":{"niche":2,"level":1,"stack":2,"remote_timezone":2,"contract_form":1,"comp_signal":2,"company_signal":2},"facts":{"level_guess":"senior","remote_policy":"remote","employment_type":"unknown","comp":{"min":90000,"max":120000,"currency":"EUR","period":"year"},"timezone_note":"Team works CET with a four hour overlap requirement.","requires_us_authorization":null,"end_client_named":true,"ai_meaning":"Building internal agent tooling and servers for the engineering organization."},"blocking_unknowns":["b2b"],"reasoning":"Product company, named, building internal agent tooling on .NET with a European timezone. Levelled Senior rather than Staff. The posting says nothing about contracting, so the engagement form stays open."}
